{
  "id": "primate-mtdna",
  "title": "Hominoid mitochondrial D-loop",
  "accessions": [
    {
      "accession": "D38112",
      "label": "Homo_sapiens"
    },
    {
      "accession": "D38113",
      "label": "Pan_troglodytes"
    },
    {
      "accession": "D38116",
      "label": "Pan_paniscus"
    },
    {
      "accession": "D38114",
      "label": "Gorilla_gorilla"
    },
    {
      "accession": "D38115",
      "label": "Pongo_pygmaeus"
    },
    {
      "accession": "X97707",
      "label": "Pongo_abelii"
    },
    {
      "accession": "X99256",
      "label": "Hylobates_lar"
    }
  ],
  "source": "NCBI Nucleotide",
  "retrieved": "2026-10-29",
  "license": "NCBI data policy: no NCBI restrictions on use or distribution; submitters may claim rights",
  "citation": "Horai S, Hayasaka K, Kondo R, Tsugane K, Takahata N (1995) Recent African origin of modern humans revealed by complete sequences of hominoid mitochondrial DNAs. PNAS 92:532-536.",
  "aligner": {
    "name": "MAFFT",
    "version": "7.525",
    "args": "--auto"
  },
  "sha256": "92df880d94c12908a1725c646d043901c338fc09b664545e84ea1cb5a4139747"
}
